,Unnamed: 0,post_id,time,text,reaction_count,label
534,587,991556047569986,2016-02-01 22:00:23,It's about damn time! BUZZPO.COM Florida Open Carry Bill Passes Committee and Advances to House Floor For Vote - BuzzPo,152,0
535,588,991501184242139,2016-02-01 18:49:42,Really Eric Trump? BUZZPO.COM Donald Trump's Son 'Snubs' Iowa Woman at Gun Show Right Before Caucus - BuzzPo,15,0
536,589,987523457973245,2016-02-01 07:00:12,"It's time to take our country back! That's why GRAA has endorsed Pastor Jack Martin for congress. Pastor Jack is a man who understands the importance of our second amendment rights, and can only be described as a true patriot. Please help fund Pastor Jack's campaign with whatever you can spare. You can donate at the link below.",2,0
537,591,990535621005362,2016-01-31 00:30:25,"WINNING! BUZZPO.COM Facebook Announces Stricter Bans on Firearms, But Gun Owners Already Beat Them - BuzzPo",285,0
538,592,990558694336388,2016-01-30 23:27:40,This officer owes his life to citizens carrying guns. BUZZPO.COM Concealed Carrier Saves Officers Life After Suspect Goes For His Gun - BuzzPo,177,0
539,593,990526404339617,2016-01-30 21:51:54,PERFECT! BUZZPO.COM [VIDEO] Texas Police Make Perfect Head Shot on Robbery Suspect With a Hostage - BuzzPo,104,0
540,596,989578167767774,2016-01-28 23:06:48,I love a happy ending! BUZZPO.COM Store Owner With Minimal Training Wins Shootout With 3 Armed Robbers & Saves His Hostage Wife -...,30,0
541,597,989438941115030,2016-01-28 15:22:20,What a horrible way to discriminate! BUZZPO.COM New Bill Would Require Gun Owners to Purchase 'Gun Insurance' - BuzzPo,19,0
542,599,989085947816996,2016-01-27 23:56:02,YIKES! BUZZPO.COM FBI Stops MUSLIM Mass Shooting at Masonic Temple That Would've Killed at Least 30 - BuzzPo,49,0
543,601,988494307876160,2016-01-26 20:41:24,Ted Cruz has stood up for our gun rights! #2A #Cruz2016 Dismantles Assault Weapons Ban YOUTU.BE Sen. Ted Cruz Dismantles Assault Weapons Ban at Gun Control Hearing,64,0
544,603,987949111264013,2016-01-25 22:00:46,"Hallelujah! It's about time. BUZZPO.COM Meet the Man Opening Chicago's First Gun Shop, and He Says It'll Look Like an Apple Store - BuzzPo",31,0
545,604,987921334600124,2016-01-25 19:30:10,And the battling continues.... BUZZPO.COM 5 Reasons Democrats Are On the Verge of a Huge Push For Gun Confiscation - BuzzPo,30,0
546,605,987902014602056,2016-01-25 17:15:01,#2A #Selfdefense #WhyweCARRY #Louisiana WWW.WWLTV.COM Armed homeowner foils break-in; sends gunmen running,54,0
547,606,987849317940659,2016-01-25 16:00:14,"Is it just me, or do they resemble the Three Stooges? BUZZPO.COM Critics Blast MA Police Superintendent For Gun Permit 'Essay Requirement' - BuzzPo",26,0
548,607,987778207947770,2016-01-25 14:00:18,New York.... Sigh. BUZZPO.COM New York Takes Steps to Ban Those On Any 'No-Fly List' From Possessing Guns - BuzzPo,18,0
549,609,987748394617418,2016-01-25 10:29:38,"Why don't some establishment Republicans like Cruz? It's because he holds then accountable to the people! #2A YOUTUBE.COM Ted Cruz says GOP senators yelled at him ""at the top of their lungs"" for derailing gun control",50,0
550,610,987576867967904,2016-01-25 07:00:11,EXCUSE ME! BUZZPO.COM Jeb Bush Says Michael Bloomberg is a 'Good Man' and a 'Patriot' - BuzzPo,28,0
551,611,987558334636424,2016-01-24 23:22:48,Need any more proof of how anti-gun Comcast is? BUZZPO.COM Comcast Rejects Great American Outdoor Show Ad Due to NRA's 'Gun Image' - BuzzPo,56,0
552,613,987465761312348,2016-01-24 19:30:32,Interesting.... BUZZPO.COM Meet 19 Professional Athletes Who Love Guns - BuzzPo,18,0
553,614,987451051313819,2016-01-24 17:31:30,Confidence or arrogance? BUZZPO.COM Trump: 'I Could Stand in the Middle of 5th Avenue and Shoot somebody and I Wouldn't Lose Voters'...,13,0
554,615,986970978028493,2016-01-23 17:27:42,Oh really..... BUZZPO.COM Flawed Poll Says More Than Half of Handgun Buyers Would Consider 'Smart' Guns - BuzzPo,41,0
555,616,986586308066960,2016-01-22 20:24:55,"It'd be interesting to hear O'Malley's response, not that he'd ever make one. BUZZPO.COM Response to Martin O'Malley's 'You Don't Need an AR-15 to Down a Deer' Comment - BuzzPo",47,0
556,617,986496811409243,2016-01-22 18:00:07,"Very well spoken pastor! BUZZPO.COM One Pastor Explains How Jesus Feels About Guns, and Liberals are Going to Hate it! - BuzzPo",132,0
557,618,986485441410380,2016-01-22 14:30:29,Will Louisiana Become the Next Constitutional Carry State? ACTION: Contact your state representative and encourage him or her to cosponsor legislation to enact Constitutional Carry in Louisiana! WWW.GUNOWNERS.ORG Permitless Carry Introduced in Louisiana | Action Alerts | State,20,0
558,619,986475861411338,2016-01-22 13:53:57,"The Dem. stupidity continues... BUZZPO.COM Dems. Setup Framework to Attack Gun Manufacturers With Endless, Frivolous Lawsuits - BuzzPo",45,0
559,620,986194758106115,2016-01-22 07:00:11,Jeb must be delusional. BUZZPO.COM Dear Jeb: 'Most Pro-2nd Amendment State' in the Nation? You're Drunk! - BuzzPo,27,0
560,621,986081704784087,2016-01-21 17:57:27,LOL. BUZZPO.COM Exactly How Many Guns Can You Open Carry in Texas - Liberals Heads Explode! - BuzzPo,81,0
561,622,985909904801267,2016-01-21 10:09:35,Okay great. What about the states that do require it? BUZZPO.COM State Introduces Bill That Would Make Concealed Carry Permits a Tax Write-Off - BuzzPo,73,0
562,623,985508438174747,2016-01-20 15:00:32,Only in Obama's America.... BUZZPO.COM 'El Chapo' Hideout Had 'Gun Strong Enough to Take Down a Helicopter' From 'Fast & Furious' - BuzzPo,26,0
563,624,985197951539129,2016-01-19 22:39:18,At least Obama's accomplished one positive. BUZZPO.COM 2015 Obliterates All Previous Background Check Records - BuzzPo,39,0
564,625,985094101549514,2016-01-19 20:28:12,#2A Don't forget who stood their ground on stand your ground! YOUTUBE.COM Ted Cruz Tells Trayvon's Mother Why Stand Your Ground Laws Can't Possibly Be 'Racist',78,0
565,626,985091028216488,2016-01-19 18:17:34,#2A Don't forget who stood up! YOUTUBE.COM Explosive Exchange at Gun Hearing Between Ted Cruz and Dianne Feinstein,96,0
566,627,984756594916598,2016-01-19 01:07:59,"This highlights the thought process of gun-grabbers. BUZZPO.COM Anti-Gun, Douchebag Bikers Participate in 'Bikes Up, Guns Down' Ride for MLK Day - BuzzPo",13,0
567,628,984643054927952,2016-01-18 17:51:53,"“This year will go down in history. For the first time, a civilized nation has full gun registration. Our streets will be safer, our police more efficient, and the world will follow our lead into the future!”― Adolf Hitler",10,0
568,629,983977711661153,2016-01-17 10:07:38,Common sense from Mike - Obama won't understand. BUZZPO.COM Mike Rowe Weighs in on Obama's Request for Celebrities to Push More Gun Control - BuzzPo,183,0
569,630,983535158372075,2016-01-16 11:44:49,Is anyone really surprised? BUZZPO.COM 2016 Brings Chicago a 200% Increase in Shootings - Social Media Blamed - BuzzPo,60,0
570,631,982398418485749,2016-01-14 00:23:36,Stupendous! BUZZPO.COM Chicago T-Mobile Employee With Concealed Carry Permit Shoots 2 Bad Guys With Guns - BuzzPo,31,0
571,632,982313558494235,2016-01-13 23:45:49,They just don't give up. BUZZPO.COM Georgia Dems. Roll Out 'Assault Weapons/Magazine' Confiscation Bill - BuzzPo,38,0
572,633,982304271828497,2016-01-13 22:00:23,"""SHUT UP!"" BUZZPO.COM Donald Trump's Epic Response to Hillary Clinton After Her Ludicrous Video - BuzzPo",160,0
573,634,982329328492658,2016-01-13 19:51:05,Holy cow!!! This would be amazing. We'd love to see him squirm. BUZZPO.COM NRA's Wayne LaPierre Issues Direct Debate Challenge to Barack Obama! - BuzzPo,196,0
574,635,981949901863934,2016-01-13 00:10:19,Happy New Year Chicago! BUZZPO.COM [VIDEO] Happy New Year Chicago - Over 100 Shot in the First 10 Days of 2016! - BuzzPo,56,0
575,636,981911111867813,2016-01-12 21:37:03,BUZZPO.COM Yet Another Gun Rights Group Endorses Ted Cruz for President - BuzzPo,34,0
576,637,981820218543569,2016-01-12 17:43:11,"""Sir I understand you're a little confused...."" BUZZPO.COM [WATCH] Ted Cruz is Flawless at Handling Protestors Jumping on His Stage - BuzzPo",95,0
577,638,981780701880854,2016-01-12 15:56:46,"Yeah, sure it does.... BUZZPO.COM [VIDEO] VP Biden: 'Second Amendment Says You Can Limit Who Can Own A Gun' - BuzzPo",36,0
578,640,981439158581675,2016-01-11 22:18:04,You must be a special kind of stupid to fall for this crap! BUZZPO.COM Trayvon Martin's Anti-Gun Mother Endorses Hillary Clinton for President - BuzzPo,26,0
579,641,980939381964986,2016-01-11 00:18:42,I'm also the #GunOwnerYouHate! BUZZPO.COM To the Man I Sat Next to on the Train: 'I am the Gun Owner You Hate!' - BuzzPo,176,0
580,642,980864348639156,2016-01-10 20:14:16,#actionalert #2A #ConstitutionalCarry #Louisiana WWW.AMERICAS1STFREEDOM.ORG Louisiana Weighs “Permitless” Concealed-Carry Amendment,99,0
581,643,980751968650394,2016-01-10 15:41:46,"Where's Obama's tears for these 2 fine, upstanding youths? BUZZPO.COM 2 Chicago Teens Shot and Killed as They Attempted to Rob a Liquor Store - BuzzPo",189,0
582,644,979799235412334,2016-01-08 18:45:20,"GRAA is proud to endorse Pastor Jack Martin for congress. He's proven to be a true patriot over the years that we've known him, and is a shining example of who we need in office. If you can find it in your hearts, please donate to his campaign. VIMEO.COM Announcment Jack Martin for Congress",4,0
583,645,979434055448852,2016-01-08 00:31:03,Is there any end to the lengths that the gun-grabbers will go? BUZZPO.COM Texas BBQ Restaurant Supporting Open Carry Receives Threat of Mass Shooting - BuzzPo,108,0
584,646,979399862118938,2016-01-07 22:18:11,"We watched so you didn't have to. BUZZPO.COM Guns in America: Obama Says 'It's Easier for a 12 or 13 Year-Old to Get a Gun, Than a Book' - BuzzPo",95,0
585,647,978968318828759,2016-01-06 23:32:39,"Ridiculous! Hickok45 is one of the nicest men you'd ever want to meet. BUZZPO.COM Famous YouTube Gun Reviewer has Channel Cancelled, but the Result Isn't What You'd Expect - BuzzPo",180,0
586,648,978594638866127,2016-01-06 08:37:38,"Wow! BUZZPO.COM Responding to Obama's 'Crocodile Tears,' One Conservative Woman Crushes Him! - BuzzPo",110,0
587,649,978493392209585,2016-01-06 02:51:46,"Some thoughts on the ""executive orders"" YOUTUBE.COM Executive orders - Obama's Foolishness and Grandstanding",9,0
588,650,978085005583757,2016-01-05 09:48:47,"in the high-profile Supreme Court gun-rights case called District of Columbia v. Heller, a brief was filed from the eighth floor of the Daniel Price Sr. State Office Building in Austin, Texas, specifically from the corner office of the man who was then the state’s solicitor general, Ted Cruz. The brief took a strong stance on the divisive question of whether the Second Amendment establishes an individual right to own guns, or just protects state and local militias. The brief argued forcefully for the first view, writing that “the individual right to keep and bear arms” is a “fundamental right” and that “an individual right that can be altogether abrogated is no right at all.” Thirty… More WWW.POLITICO.COM How Ted Cruz Became Ted Cruz",49,0
589,651,977893845602873,2016-01-04 22:53:24,"""How's that for a big middle finger to Barack?"" BUZZPO.COM Ted Cruz on Obama's Gun Actions: 'My Pen Has an Eraser!' - BuzzPo",77,0
590,652,977880115604246,2016-01-04 21:58:44,"Get ready, here it comes! BUZZPO.COM GOP Candidates and NRA React to Obama's Imminent Executive Orders on Guns - BuzzPo",28,0
591,653,977864745605783,2016-01-04 21:05:49,"Some folks make excuses, other folks make it happen. This kid makes it happen with no hands! YOUTUBE.COM 'Nubs'- The No-handed Shooter | Shooter with no hands (4K)",10,0
592,654,977818632277061,2016-01-04 18:25:10,the right to carry a concealed handgun without a permit or license. SHALLNOT.ORG Bill Seeks to Strengthen the Right to Keep and Bear Arms in Louisiana,289,0
593,655,977476818977909,2016-01-04 00:01:26,"Okay, we really like this sheriff! BUZZPO.COM Sheriff on Deadly Home Invasion: 'You Can Expect To Be Shot In Polk County!' - BuzzPo",58,0
594,656,977269295665328,2016-01-03 16:00:49,Only in a liberal cesspool like Chicago... BUZZPO.COM Chicago Airport Police Told to 'Run and Hide' In the Event of an Active Shooter - BuzzPo,55,0
595,657,977197739005817,2016-01-03 11:08:02,This woman is NUTS! BUZZPO.COM MSNBC's Harris-Perry Says Confiscate Legal Guns So Husbands Don't Shoot Their Wives - BuzzPo,86,0
596,658,976980295694228,2016-01-02 23:28:28,"Just like she intends to 'crumple up' our rights! BUZZPO.COM NRA Releases 'New Year's Resolution' Video Mocking Hillary, and it's EPIC! - BuzzPo",37,0
597,659,976945552364369,2016-01-02 21:09:16,"""Ironically, many of the Black Lives Matter supporters are also anti-gun democrats. So since they despise ‘good guys with guns,’ perhaps they believe that all violent crime will just magically stop once all the cops are gone. Everyone will just sit around a campfire with their S’mores and sing Kumbaya!"" BUZZPO.COM Black Lives Matter Calls for Dismantling Police Following Tamir Rice Verdict - BuzzPo",36,0
598,660,976457649079826,2016-01-01 18:51:41,A truly historic day! BUZZPO.COM Thousands Shot on First Day of Texas Legalized Open Carry - OR NOT! - BuzzPo,244,0
599,661,975441269181464,2015-12-30 23:18:56,"How many of you have done this? BUZZPO.COM Concealed Carrier Stabbed to Death in His Driveway, and He Left His Gun Inside - BuzzPo",31,0
600,662,975422669183324,2015-12-30 22:17:10,California is a joke! BUZZPO.COM Gun Confiscation in California to Start on Jan. 1 - Happy New Year! - BuzzPo,85,0
601,663,975172339208357,2015-12-30 11:10:01,NICE! BUZZPO.COM Fox News Host Just Posted This Amazing Selfie to Her Instagram - BuzzPo,100,0
602,664,974750662583858,2015-12-29 16:12:10,"""God helps those who help themselves."" BUZZPO.COM Preventing a Mass Shooting in Your Church - 'God Helps Those Who Help Themselves' - BuzzPo",14,0
603,665,974576999267891,2015-12-29 15:11:13,"Can you really claim to be pro second amendment if you donate to anti gun liberals? WWW.NATIONALREVIEW.COM Did You Know Terry McAuliffe Took $25,000 From Donald Trump?",16,0
604,666,974569699268621,2015-12-29 08:48:40,"#2A Greg Ellifritz December 27, 2014 at 9:56 PM · Interesting experience at the shooting range this afternoon.... The range is packed. Everyone got new guns for X-mas and wants to shoot them. There was about an hour wait for a stall. I sit down and start reading as I wait my turn. In a few minutes, a young girl sits down to wait in the chair next to mine. She's by herself and appears to be in her early 20s. She's the only black person in the room and one of the only women. She seems nervous as she fiddles with the gun case in her lap. She's obviously uncomfortable. Uncomfortable people with guns in their hands shooting in the stall next to me isn't what I like to see. I decide to talk to her. Keep in mind that no one at this range…",162,0
605,667,974350289290562,2015-12-28 22:17:37,Agree or disagree? BUZZPO.COM Grand Jury Declines to Indict Officers in Tamir Rice Shooting - Gov. Kasich Calls for Calm - BuzzPo,23,0
606,668,974291399296451,2015-12-28 19:34:28,"Action alert. Some nitwit from Rhode Island is trying to infringe on our #2A rights again! HR 4269: To regulate assault weapons, to ensure that the right to keep and bear arms is not unlimited, and for other purposes. WWW.CONGRESS.GOV Text - H.R.4269 - 114th Congress (2015-2016): Assault Weapons Ban of 2015",12,0
607,669,973864199339171,2015-12-27 22:32:58,A sad side affect of #GunSense.,53,0
608,670,973787229346868,2015-12-27 20:00:38,"I doubt they'd be foolish enough to try this in the U.S. BUZZPO.COM NO, the Muslim Fake Bomb Prank Guy Didn't Get Shot - Here's Why - BuzzPo",18,0
609,671,973758552683069,2015-12-27 17:10:08,Sigh.... BUZZPO.COM Police Officer Fires Gun Inside Airport While Practicing his 'Quick Draw Skills' - BuzzPo,35,0
610,672,973399199385671,2015-12-26 22:55:31,Define irony.... BUZZPO.COM #BlackLivesMatter Supporter Tweets 'Wack a Cracker' - Dead After Opening Fire in a Mall - BuzzPo,120,0
611,673,973355959389995,2015-12-26 19:52:44,"""Donkey Cartel was a sweet, loving boy...."" BUZZPO.COM Deceased Donkey Cartel's Mother Questions Whether Cop Asked Him to Drop the Gun - BuzzPo",25,0
612,674,972806079444983,2015-12-25 12:10:43,"The 'Donkey's Cartel' has made its final voyage. BUZZPO.COM 'Good Guy With a Gun' Stops Mall Shooting, but Shooters Identity is SHOCKING - BuzzPo",514,0
613,675,972569392801985,2015-12-25 01:20:21,WINNING! BUZZPO.COM WINNING - 80% AR Lowers & Uppers Being Sold on Amazon as 'Art Pieces' - BuzzPo,183,0
614,676,972005126191745,2015-12-23 17:00:00,"A great Merry Christmas email we got from our friends over at New Hampshire Firearms Coalition. Our trusted friend and adviser, Executive Councilor David Wheeler (R-Milford) has told me that he has recently heard from the New Hampshire State Police that our state has entered into concealed carry reciprocity agreements with Maine and West Virginia. The New Hampshire Resident Pistol / Revolver license is now accepted for concealed carry in 25 other states. You can click below for the complete list. In addition to the above reciprocity states, you may lawfully carry concealed in all ""Constitutional Carry"" states such as Vermont, Kansas, Alaska, Arizona and a few others. Thanks for your support. NH.GOV Pistol and Revolver Licensing, Permits and Licensing, Support Services - Division of State...",9,0
615,677,971908312868093,2015-12-23 12:02:53,"""Guns don't kill people - AMERICANS KILL PEOPLE!"" BUZZPO.COM Michael Moore: 'Guns Don't Kill People, AMERICANS KILL PEOPLE' - BuzzPo",35,0
616,678,971508959574695,2015-12-22 19:41:14,BUZZPO.COM Stag Arms Pleads Guilty to Federal Firearms Charges - Owner Must Walk Away - BuzzPo,9,0
617,679,971321742926750,2015-12-22 10:25:35,UNBELIEVABLE! BUZZPO.COM Virginia Revoking Concealed Carry Reciprocity With 25 Other States - BuzzPo,95,0
618,680,971138359611755,2015-12-21 23:41:40,"Still waiting for Obama's ""CAR-CONTROL"" speech. BUZZPO.COM Las Vegas Strip Tragedy - Suspect Mowed Down 37 People Because She Was Tired - BuzzPo",180,0
619,681,970947942964130,2015-12-21 19:42:04,BUZZPO.COM Gun Rights Group Gives THIS Away for Christmas - BuzzPo,20,0
620,682,970497549675836,2015-12-21 12:49:14,THEPATRIOTNATION.NET Leading Gun Rights Activist Makes HUGE Announcement… Something BIG is Coming This Christmas –...,34,0
621,683,970356439689947,2015-12-21 10:28:58,"FOR IMMEDIATE RELEASE: The organization that would later become Gun Rights Across America began after the Sandy Hook shooting by Eric Reed. Eric pledged to fight against the constant attacks that were aimed at destroying this nation's firearm rights in an effort to help ensure people across America could protect themselves. With some help from some outstanding people, he was able to watch GRAA become a known name in the firearms community. One of the greatest accomplishments under his command was a nationwide rally on January 19th of 2013, which saw over 100 thousand people attend in various states. Eric, along with many other people, has spent countless hours managing GRAA and distributing… More",7,0
622,684,970097239715867,2015-12-20 23:33:30,Just breaking.... BUZZPO.COM N.H. Schools Closed Monday Due to Specific Threats of Violence - BuzzPo,12,0
623,685,970089289716662,2015-12-20 23:01:28,Nice to hear an expert just come out and say it! BUZZPO.COM Counter-Terrorism Expert Calls for Concealed Carriers to Defend Against Terrorism - BuzzPo,184,0
624,686,970055456386712,2015-12-20 20:58:48,Well said Sheriff Joe! BUZZPO.COM Sheriff Joe Arpaio: 'I'M NOT SURRENDERING THE GUNS!' - BuzzPo,130,0
625,687,969837966408461,2015-12-20 12:03:37,In her opinion? Sigh.... BUZZPO.COM Clinton Says Americans are Wrong in Latest Gun Control Poll During Debate - BuzzPo,51,0
626,688,969591509766440,2015-12-19 23:59:05,#TrumpTweets BUZZPO.COM Donald Trump Responds to #DemDebate With Epic Tweet About Gun Control - BuzzPo,60,0
627,689,969585559767035,2015-12-19 23:12:54,"""If somebody has evil in their heart, they don't need a gun to inflict unimaginable horror."" BUZZPO.COM [VIDEO] Florida Man Stabs his Mother 'too Many Times to Count' - BuzzPo",47,0
628,690,969557449769846,2015-12-19 21:29:48,The ignorance from these ladies is astounding. BUZZPO.COM [VIDEO] Kurt Russell Schools 'The View' on the 2nd Amendment - BuzzPo,62,0
629,691,969517693107155,2015-12-19 18:47:01,"Oh, the irony! BUZZPO.COM Infamous Anti-gun Sheriff Shoots Himself in the Hand While Cleaning his Gun - BuzzPo",448,0
630,692,968879496504308,2015-12-18 11:41:45,"Dana for president? BUZZPO.COM Dana Loesch: I Have a Problem With 'Tragedy, Dry-Humping Whores!' - BuzzPo",86,0
631,693,968540593204865,2015-12-17 20:04:01,Suspect was a coward who was too stupid to ask for help. BUZZPO.COM [VIDEO] Camarillo Deputy Shoots and Kills Knife-Wielding Man - BuzzPo,29,0
632,694,968466496545608,2015-12-17 15:42:43,Just breaking.... BUZZPO.COM Syed Farook's Former Neighbor Arrested for San Bernardino Terror Attack - BuzzPo,37,0
633,695,968403233218601,2015-12-17 12:58:56,Mark Kelly's at it again. BUZZPO.COM Mark Kelly: Current Gun Laws are 'Magnets for Terror Attacks.' - BuzzPo,29,0
634,696,967957643263160,2015-12-16 16:00:47,JUST BREAKING.... BUZZPO.COM Mistrial Declared for First Police Officers Trial in Freddie Gray Death - BuzzPo,29,0
635,697,967882773270647,2015-12-16 12:33:16,Good luck with that! BUZZPO.COM House Democrats Introduce a New 'Assault Weapons Ban' - BuzzPo,32,0
636,698,966596306732627,2015-12-13 18:55:01,"It's funny, but sad because it's so true. BUZZPO.COM Hilarious New Video Mocks Gun-Grabbers With Pure Common Sense - BuzzPo",104,0
637,699,966149740110617,2015-12-12 23:49:00,"Somebody isn't on board with 'The Donald.' LOL. BUZZPO.COM A 'Blunt Redneck from Iowa' Calls Out Donald Trump - ""BRING IT, LET'S PLAY"" - BuzzPo",13,0
638,700,965990156793242,2015-12-12 13:55:07,BRILLIANT!!! BUZZPO.COM [VIDEO] Trey Gowdy Annihilates DHS Official on No-Fly List and the 2nd Amendment - BuzzPo,180,0
639,701,965739153485009,2015-12-11 22:53:48,THEHILL.COM Dems link votes on spending bill to allowing gun violence research,6,0
640,703,965645446827713,2015-12-11 17:45:19,"Yep, he actually said that! BUZZPO.COM Sheriff Says He'll Point Guns at Lawful Citizens Carrying a Gun - 'or WORSE' - BuzzPo",78,0
641,704,965287333530191,2015-12-10 21:44:51,"We have a new favorite actor! BUZZPO.COM Kurt Russell on Gun Culture: 'What Are You Going to Do, Ban Everything?' - BuzzPo",334,0
642,705,965159623542962,2015-12-10 15:55:44,Just breaking.... BUZZPO.COM Obama Set to Take Executive Action - Background Checks and 'Gun Show Loophole' - BuzzPo,26,0
643,706,965082683550656,2015-12-10 12:09:40,A piece of brass is too good for a terrorist. BUZZPO.COM [VIDEO] Lawmaker: 'I'm About to Fly to Paris and Shoot 'em in the Head Myself!' - BuzzPo,9,0
644,707,964881063570818,2015-12-10 01:13:00,What's your thoughts - Execution or justified shooting? BUZZPO.COM Police Execution or Justified Shooting - Where's Al Sharpton on This One? - BuzzPo,15,0
645,708,964790823579842,2015-12-09 19:00:49,Is this a good idea? BUZZPO.COM Gun Rights Group Holding 'Mock Mass Shooting' at Major University - BuzzPo,8,0
646,709,964776693581255,2015-12-09 17:41:49,So this is happening in Chicago right now. BUZZPO.COM Rahm Emanuel Says 'I'm Sorry' - Protestors Still Demanding his Resignation - BuzzPo,29,0
647,710,964671733591751,2015-12-09 12:52:49,Nothing but crickets from the gun-grabbers on this. BUZZPO.COM Still Don't Think Guns Save Lives - Here's 18 Times They Did! - BuzzPo,107,0
648,711,964452546947003,2015-12-09 00:06:36,This could be an issue! BUZZPO.COM Trump Says He'd Look at Banning Guns for Those on the No-Fly List - BuzzPo,26,0
649,712,964258483633076,2015-12-08 14:00:25,Most EXCELLENT! BUZZPO.COM Thank You Obama - President Sells Over 100 Million Guns Since Taking Office - BuzzPo,203,0
650,713,964231413635783,2015-12-08 11:08:52,"""I'VE GOT YOU!"" BUZZPO.COM San Bernardino Victims Last Words: 'I've Got You,' as he Saves Woman from Gunfire - BuzzPo",47,0
651,714,964079830317608,2015-12-08 07:30:05,"Finally, somebody with a brain. BUZZPO.COM Jerry Falwell Jr. Tells University Students to Carry Concealed on Campus - BuzzPo",137,0
652,715,964033103655614,2015-12-07 23:45:24,"The plot thickens. BUZZPO.COM Bank Records: Farook Received a $28,500 Deposit Shortly Before Attack - BuzzPo",43,0
653,716,963904017001856,2015-12-07 22:30:43,Excellent response. BUZZPO.COM [VIDEO] Mr. Colion Noir Makes Epic Rebuttal to Calls for More Gun Control - BuzzPo,138,0
654,717,963993650326226,2015-12-07 21:15:03,"Good luck with that. BUZZPO.COM HuffPost says 'DOMESTIC DISARMAMENT,' Not Gun Control - BuzzPo",66,0
655,718,963892317003026,2015-12-07 20:00:44,"Well, this is disappointing. BUZZPO.COM Supreme Court Refuses to Hear Illinois 'Assault Weapons' Case - BuzzPo",14,0
656,719,963965766995681,2015-12-07 18:37:39,"""Unfortunately, that terrifying fact just can’t be overlooked. The couple left the devices behind to not only kill first responders, but also to send a message to first responders in future attacks. One would likely assume that another strike is already planned or well in the works. Now more than ever, it’s imperative for all Americans to get trained and carry a firearm."" BUZZPO.COM Terrorist Couple 'Booby Trapped' Crime Scene with Bombs for First Responders - BuzzPo",55,0
657,720,963872220338369,2015-12-07 17:00:24,BOOM! BUZZPO.COM [WATCH] The NRA's Perfect Response to Obama's Calls for More Gun Control - BuzzPo,163,0
658,721,963839183675006,2015-12-07 14:00:45,Well said sheriff! BUZZPO.COM Yet Another Sheriff Comes Out - Tells Citizens to Carry in Prevention of Mass Shootings - BuzzPo,160,0
